Item Id,Stock Code,Part No,Description,Car Model,Brand,Category,Cost Price,Sell Price,Last Sell Price,Current Quantity,Stock Take,Reason
24560,9789673435739,,MODUL PEMAHAMAN BAHASA MALAYSIA UPSR TAHUN 5,,ILMU BAKTI (CHC),B.MELAYU REF (1-6),0,2.3,0,0,11,
24561,9789831584415,,SKOR A PENULISAN BAHASA MELAYU TAHUN 5,,PRESTON,B.MELAYU REF (1-6),0,4,0,0,3,
24562,9789831932193,,STRATEGI MENJAWAP KARANGAN BAHASA MELAYU UPSR,,PNI,B.MELAYU REF (1-6),0,3,0,0,3,
24563,9789831931059,,PINTAR KARANGAN TAHUN 5,,PNI,B.MELAYU REF (1-6),0,1.9,0,0,25,
24564,9789838863964,,SIRI PRAKTIS TERBILANG PERMAHAMAN TAHUN 5,,PNI,B.MELAYU REF (1-6),0,1,0,0,10,
24565,9789838865265,,PRAKTIS INTERLEK KSSR PEMAHAMAN TAHAUN 5,,PNI,B.MELAYU REF (1-6),0,1,0,0,12,
24567,9789838864855,,PRAKTIS INTELEK KBSR TATABAHASA TAHUN 5,,PNI,B.MELAYU REF (1-6),0,1,0,0,28,
24568,9789832545101,,PINTAR TATABAHASA TAHUN 5,,PNI,B.MELAYU REF (1-6),0,1.35,0,0,20,
24569,9789831932919,,SIRI PRAKTIS PRIMA BAHASA MELAYU,,PNI,B.MELAYU REF (1-6),0,1.5,0,0,6,
24570,9789831930779,,SIRI PRAKTIS CENDEKIAWAN BAHASA MELAYU TAHUN 5,,PNI,B.MELAYU REF (1-6),0,2.1,0,0,22,
24571,9789838861748,,PENILAIAN TOPIKAL BESTARI BAHASA MELAYU TAHUN 5,,PNI,B.MELAYU REF (1-6),0,2,0,0,2,
24572,9789831930991,,PINTAR PEMAHAMAN TAHUN 5,,PNI,B.MELAYU REF (1-6),0,1.9,0,0,11,
24573,9789679189407,,SIRI PEPERIKSAAN BAHASA MELAYU PRIMARY 5,,PUSTAKA ZAMAN (PRE),B.MELAYU REF (1-6),0,10.8,0,0,,
24574,9789837704060,,BUKU RAMPAIAN PINTAR BAHASA MELAYU KSSR TAHUN 5,,SASBADI (CHC),B.MELAYU REF (1-6),0,1.65,0,0,7,
24575,9789670856032,,HOMEWORK BAHASA MALAYSIA TAHUN 5 KSSR,,MBP PUB (CHC),B.MELAYU REF (1-6),0,2.15,0,0,6,
24576,9789834701000,,SMART PRACTICE BAHASA MALAYSIA KBSR TAHUN 5 (2011),,OXFORD FAJAR,B.MELAYU REF (1-6),0,2.6,0,0,3,
24577,9789673438754,,PRAKTIS PENTAKSIRAN PKSR BAHASA MALAYSIA TAHUN 5,,ILMU BAKTI,B.MELAYU REF (1-6),0,2.25,0,0,5,
24578,9789836001337,,SIRI TOPIKAL RM2 BAHASA MELAYU TAHUN 5,,MCI (M),B.MELAYU REF (1-6),0,1.1,0,0,3,
24579,9789676021151,,MY-VISI A TOPIKAL BAHASA MELAYU TAHUN 5,,PAN PAC (M),B.MELAYU REF (1-6),0,2.5,0,0,6,
24580,9789673437788,,MODUL PEMAHAMAN BAHASA MALAYSIA (011) UPSR TAHUN 5,,ILMU BAKTI,B.MELAYU REF (1-6),0,2.25,0,0,4,
24581,9789673031894,,PINTAR BAHASA TATABAHASA TAHUN 5,,MCI (M),B.MELAYU REF (1-6),0,1.2,0,0,3,
24582,9789673034116,,JACKS TOPICAL CORNER SJK(C) BAHASA MALAYSIA TAHUN 5,,MCI (M),B.MELAYU REF (1-6),0,1.4,0,0,8,
24584,9789837434745,,RESOS PEMBELAJARAN MASTERI BAHASA MELAYU TAHUN 5,,PEARSON LONGMAN,B.MELAYU REF (1-6),0,3.2,0,0,4,
24585,9789833348138,,i-ASSESS PRE-UPSR BAHASA MELAYU TAHUN 5,,MCI (M),B.MELAYU REF (1-6),0,1.2,0,0,4,
24586,9789673513352,,PRAKTIS STANDARD BAHASA MALAYSIA TAHUN 5,,PNI,B.MELAYU REF (1-6),0,1.65,0,0,10,
24587,9789833885541,,PRAKTIS GEMILANG BAHASA MALAYSIA TAHUN 5,,PNI,B.MELAYU REF (1-6),0,1.6,0,0,5,
24588,9789834501419,,SMART PRACTICE BAHASA MALAYSIA KBSR TAHUN 5,,OXFORD FAJAR,B.MELAYU REF (1-6),0,2.6,0,0,3,
24589,9789676016300,,STUDI N PRAKTIS TOPIKAL BAHASA MELAYU TAHUN 5,,MCI (M),B.MELAYU REF (1-6),0,2.6,0,0,5,
24590,9789838862318,,PRAKTIS CEMERLANG BAHASA MELAYU TAHUN 5,,PNI,B.MELAYU REF (1-6),0,2.6,0,0,4,
24591,9789676576576,,PRAKTIS TOPIKAL BESTARI BAHASA MALAYSIA KBSR TAHUN 5,,OXFORD FAJAR,B.MELAYU REF (1-6),0,2,0,0,,
24592,9789679187786,,SIRI BESTARI PEMAHAMAN & LISAN TAHUN 5,,PUSTAKA ZAMAN (PRE),B.MELAYU REF (1-6),0,3.3,0,0,2,
24593,9789833348404,,SIRI TUNAS PINTAR BAHASA MELAYU TAHUN 5,,MCI (M),B.MELAYU REF (1-6),0,1.3,0,0,9,
24594,9789676550255,,MENGENAL HURUF JAWI TAHUN 5 KBSR,,OXFORD FAJAR,B.MELAYU REF (1-6),0,2.5,0,0,6,
24595,9789673030880,,TOPICAL POWER BAHASA MALAYSIA TAHUN 5,,MCI (M),B.MELAYU REF (1-6),0,1.1,0,0,2,
24597,9789971029524,,PANDAI MENGARANG UNTUK DARJAH 5,,PAN PAC (M),B.MELAYU REF (1-6),0,4.8,0,0,4,
24598,9789673030347,,EXCEL @ PRACTICE BAHASA MALAYSIA TAHUN 5,,MCI (M),B.MELAYU REF (1-6),0,1.7,0,0,6,
24599,9789676017697,,i-MASTERI TOPIKAL BAHASA MELAYU TAHUN 5,,MCI (M),B.MELAYU REF (1-6),0,2.6,0,0,7,
24600,9789679187625,,PRAKTIS TOPIKAL CEMERLANG BAHASA MELAYU TAHUN 5,,PUSTAKA ZAMAN (PRE),B.MELAYU REF (1-6),0,3.4,0,0,3,
24602,9789676020260,,BAHASA MELAYU TATABAHASA TAHUN 5,,MCI (M),B.MELAYU REF (1-6),0,1.4,0,0,1,
24603,9789837418028,,PROGRAM PEMBELAJARAN MASTERI BAHASA MALAYSIA TAHUN 5,,PEARSON LONGMAN,B.MELAYU REF (1-6),0,3.1,0,0,4,
24604,9789676020321,,BAHASA MELAYU PEMAHAMAN TAHUN 5,,MCI (M),B.MELAYU REF (1-6),0,1.4,0,0,7,
24605,9789673434459,,PRAKTIS PENTAKSIRAN BAHASA MALAYSIA PRAKTIS TOPIKAL TAHUN 5 KBSR,,ILMU BAKTI (CHC),B.MELAYU REF (1-6),0,2.15,0,0,6,
24606,9789834703790,,EFFECTIVE PRACTICE BAHASA MALAYSIA KBSR TAHUN 5,,OXFORD FAJAR,B.MELAYU REF (1-6),0,2.7,0,0,8,
24607,9789673033478,,SCORING STARS BAHASA MALAYSIA TAHUN 5,,MCI (M),B.MELAYU REF (1-6),0,1.7,0,0,16,
24705,,,1 SET LEMBARAN PRAKTIS PRIMA BAHASA MELAYU TAHUN 5,,PEARSON LONGMAN,B.MELAYU REF (1-6),0,4.1,0,1,1,
24707,,,1 SET LONGMAN IDEAL BAHASA MALAYSIA TAHUN 5,,PEARSON LONGMAN,B.MELAYU REF (1-6),0,4.4,0,4,4,
24708,9789835803864,,LEMBARAN UJIAN TOPIKAL BAHASA MALAYSIA TAHUN 5,,MCI (M),B.MELAYU REF (1-6),0,1.9,0,0,1,
24712,9789838860741,,SIRI PRAKTIS TERBILANG TATABAHASA TAHUN 5,,PNI,B.MELAYU REF (1-6),0,1.1,0,0,5,
24713,9789676020383,,BAHASA MELAYU PENULISAN TAHUN 5,,MCI (M),B.MELAYU REF (1-6),0,1.4,0,0,5,
24717,9789831939222,,SIRI PRAKTIS BESTARI BAHASA MELAYU TAHUN 5,,PNI,B.MELAYU REF (1-6),0,1.4,0,0,10,
24734,9789673036738,,JOM STUDI BAHASA MALAYSIA TAHUN 6,,MCI (M),B.MELAYU REF (1-6),0,1.8,0,0,9,
24735,9789831939239,,SIRI PRAKTIS BESTARI BAHASA MELAYU TAHUN 6,,PNI,B.MELAYU REF (1-6),0,1.4,0,0,13,
24736,9789832545118,,PINTAR TATABAHASA TAHUN 6,,PNI,B.MELAYU REF (1-6),0,1.4,0,0,12,
24737,9789673575237,,PRAKTISKU BAHASA MALAYSIA TAHUN 6,,MCI (M),B.MELAYU REF (1-6),0,1.8,0,0,6,
24738,9789838865272,,PRAKTIS INTELEK KSSR PEMAHAMAN TAHUN 6,,PNI,B.MELAYU REF (1-6),0,1,0,0,14,
24739,9789838860819,,SIRI PRAKTIS TERBILANG PEMAHAMAN TAHUN 6,,PNI,B.MELAYU REF (1-6),0,1.1,0,0,16,
24740,9789838864862,,PRAKTIS INTELEK KBSR TATABAHASA TAHUN 6,,PNI,B.MELAYU REF (1-6),0,1,0,0,16,
24741,9789679186116,,BACAAN BESTARI KBSR BAHASA MALAYSIA 6,,PUSTAKA ZAMAN (PRE),B.MELAYU REF (1-6),0,6.05,0,0,2,
24742,9789679189414,,SISTEM BAHASA LENGKAP TAHUN 6,,PUSTAKA ZAMAN (PRE),B.MELAYU REF (1-6),0,11.6,0,0,9,
24743,9789673394548,,ESENSI PENULISAN BAHASA MALAYSIA UPSR,,PEARSON LONGMAN,B.MELAYU REF (1-6),0,6.5,0,0,3,
24744,9789810745769,,INTELEK ARIF BUDIMAN BAHASA MELAYU DARJAH 6 (2013),,FBP,B.MELAYU REF (1-6),0,6.2,0,0,6,
24745,9789814252836,,LATIHAN PEPERIKSAAN BAHASA MELAYU DARJAH 6,,FBP,B.MELAYU REF (1-6),0,5.8,0,0,3,
24746,9789837705197,,PINTAR CERDAS BAHASA MELAYU TAHUN 6 KSSR,,SASBADI (CHC),B.MELAYU REF (1-6),0,3.3,0,0,3,
24747,9789673000579,,ESENSI TATABAHASA UPSR ,,PEARSON LONGMAN,B.MELAYU REF (1-6),0,6.1,0,0,1,
24748,9789837704077,,BUKU RAMPAIAN PINTAR BAHASA MELAYU KSSR TAHUN 6,,SASBADI (CHC),B.MELAYU REF (1-6),0,1.65,0,0,3,
24749,9789673437825,,MODUL PENULISAN BAHASA MALAYSIA (012) UPSR TAHUN 6,,ILMU BAKTI,B.MELAYU REF (1-6),0,2.95,0,0,4,
24751,9789674544034,,PRAKTIS PENTAKSIRAN DSKP BAHASA MELAYU TAHUN 6 KSSR,,ILMU BAKTI,B.MELAYU REF (1-6),0,2.2,0,0,9,
24752,9789679188929,,TATABAHASA BESTARI TAHUN 6 EDISI TERBAHARU,,PUSTAKA ZAMAN (PRE),B.MELAYU REF (1-6),0,4.75,0,0,11,
24753,9789670856049,,HOMEWORK BAHASA MALAYSIA TAHUN 6 KSSR,,MBP PUB (CHC),B.MELAYU REF (1-6),0,2.15,0,0,6,
24754,9789673438792,,PRAKTIS PENTAKSIRAN PKSR  BAHASA MALAYSIA PRAKTIS TOPIKAL TAHUN 6 KBSR,,ILMU BAKTI,B.MELAYU REF (1-6),0,2.25,0,0,7,
24755,9789673437795,,MODUL PEMAHAMAN BAHASA MALAYSIA (011) UPSR TAHUN 6 (2013),,ILMU BAKTI,B.MELAYU REF (1-6),0,2.25,0,0,5,
24756,9789971029456,,PANDAI MENGARANG DARJAH 6,,PAN PAC,B.MELAYU REF (1-6),0,4.9,0,0,13,
24757,9789814123617,,MENGARANG DENGAN BAIK! KARANGAN BERPANDUAN DAN GAMBAR TAHUN 6,,SAP,B.MELAYU REF (1-6),0,4.9,0,0,2,
24758,9789673033485,,SCORING STARS BAHASA MALAYSIA TAHUN 6,,MCI (M),B.MELAYU REF (1-6),0,1.7,0,0,5,
24759,9789673030354,,EXCEL @ PRACTICE BAHASA MALAYSIA TAHUN 6,,MCI (M),B.MELAYU REF (1-6),0,1.7,0,0,7,
24760,9789837434752,,RESOS PEMBELAJARAN MASTERI BAHASA MELAYU TAHUN 6,,PEARSON LONGMAN,B.MELAYU REF (1-6),0,3.7,0,0,4,
24761,9789676017741,,i-MASTERI TOPIKAL BAHASA MELAYU TAHUN 6,,MCI (M),B.MELAYU REF (1-6),0,2.6,0,0,6,
24762,9789831935965,,MODEL SOALAN KLON BAHASA MELAYU UPSR KERTAS 1,,PNI,B.MELAYU REF (1-6),0,1.1,0,0,10,
24764,9789673032020,,PINTAR BAHASA PENULISAN TAHUN 6,,MCI (M),B.MELAYU REF (1-6),0,1.2,0,0,2,
24765,9789838861663,,PRAKTIS GENIUS BAHASA MELAYU TAHUN 6,,PNI,B.MELAYU REF (1-6),0,1.6,0,0,1,
24766,9789833347476,,TOPICAL SUCCESS CODE BAHASA MELAYU TAHUN 6,,MCI (M),B.MELAYU REF (1-6),0,3.3,0,0,7,
24767,9789834701017,,SMART PRACTICE BAHASA MALAYSIA KBSR TAHUN 6,,OXFORD FAJAR,B.MELAYU REF (1-6),0,2.6,0,0,8,
24770,9789676595492,,MASTERI TATABAHASA TAHUN 6 KBSR,,OXFORD FAJAR,B.MELAYU REF (1-6),0,2.5,0,0,1,
24771,9789676576590,,PRAKTIS TOPIKAL BESTARI BAHASA MALAYSIA KBSR TAHUN 6 (2004/2005),,OXFORD FAJAR,B.MELAYU REF (1-6),0,2,0,0,4,
24772,9789676585233,,PRAKTIS TOPIKAL BESTARI BAHASA MALAYSIA KBSR TAHUN 6 (2005/2006),,OXFORD FAJAR,B.MELAYU REF (1-6),0,2,0,0,,
24773,9789676020338,,BAHASA MELAYU PEMAHAMAN TAHUN 6,,MCI (M),B.MELAYU REF (1-6),0,1.4,0,0,6,
24774,9789676020390,,BAHASA MELAYU PENULISAN TAHUN 6,,MCI (M),B.MELAYU REF (1-6),0,1.4,0,0,7,
24775,9789679188219,,PRAKTIS TOPIKAL CEMERLANG BAHASA MELAYU TAHUN 6,,PUSTAKA ZAMAN (PRE),B.MELAYU REF (1-6),0,3.4,0,0,2,
24776,9789673434497,,PRAKTIS PENTAKSIRAN BAHASA MALAYSIA PRAKTIS TOPIKAL TAHUN 6 KBSR,,ILMU BAKTI (CHC),B.MELAYU REF (1-6),0,2.15,0,0,5,
24777,9789676021168,,MY-VISI A TOPIKAL BAHASA MELAYU TAHUN 6,,MCI (M),B.MELAYU REF (1-6),0,2.5,0,0,7,
24778,9789676016577,,FOKUS PRESTASI UPSR BAHASA MELAYU ,,MCI (M),B.MELAYU REF (1-6),0,2,0,0,8,
24779,9789833348411,,SIRI TUNAS PINTAR PRA-UPSR SJK (C) BAHASA MELAYU TAHUN 6,,MCI (M),B.MELAYU REF (1-6),0,1.3,0,0,10,
24781,9789834501433,,SMART PRACTICE BAHASA MALAYSIA KBSR TAHUN 6,,OXFORD FAJAR,B.MELAYU REF (1-6),0,2.6,0,0,3,
24782,9789673435746,,MODUL PEMAHAMAN BAHASA MALAYSIA (011) UPSR TAHUN 6,,ILMU BAKTI (CHC),B.MELAYU REF (1-6),0,2.3,0,0,8,
24783,9789833348145,,i-ASSESS PRE-UPSR BAHASA MELAYU TAHUN 6,,MCI (M),B.MELAYU REF (1-6),0,1.2,0,0,4,
24785,9789673034512,,DOLPHIN SERIES PRE-PKSR ASSESSMENT BAHASA MALAYSIA TAHUN 6,,MCI (M),B.MELAYU REF (1-6),0,1.3,0,0,9,
24786,9789673034123,,JACKS TOPICAL CORNER SJK(C) BAHASA MALAYSIA TAHUN 6,,MCI (M),B.MELAYU REF (1-6),0,1.4,0,0,9,
24787,9789814638081,,PINTAR BAHASA MELAYU DARJAH 6,,AKAR EDU (MA),B.MELAYU REF (1-6),0,14.3,0,0,3,
24788,9789673031351,,REPLIKA 4U SOALAN UPSR  SJK (C)  BAHASA MALAYSIA,,MCI (M),B.MELAYU REF (1-6),0,2.6,0,0,6,
24789,9789673031306,,REPLIKA 4U SOALAN UPSR BAHASA MALAYSIA ,,MCI (M),B.MELAYU REF (1-6),0,2.3,0,0,3,
24790,9789833349197,,REPLIKA 2U SOALAN UPSR BAHASA MELAYU ,,MCI (M),B.MELAYU REF (1-6),0,2,0,0,3,
24791,9789835976186,,KUNCI EMAS KERTAS MODEL UPSR BAHASA MALAYSIA ,,SASBADI (CHC),B.MELAYU REF (1-6),0,2.6,0,0,6,
24792,9789674543365,,GENIUS DSKP BAHASA MELAYU KSSR TAHUN 6,,ILMU BAKTI,B.MELAYU REF (1-6),0,3.55,0,0,4,
24793,9789814473781,,SAYA BOLEH MENGARANG DARJAH 5/6,,eph,B.MELAYU REF (1-6),0,6.2,0,0,2,
24794,9789679187793,,SIRI BESTARI PEMAHAMAN & LISAN TAHUN 6,,PUSTAKA ZAMAN (PRE),B.MELAYU REF (1-6),0,3.3,0,0,3,
24877,,,1 SET LEMBARAN PRAKTIS PRIMA BAHASA MELAYU TAHUN 6,,PEARSON LONGMAN,B.MELAYU REF (1-6),0,4.1,0,3,6,
24878,,,1 SET LONGMAN IDEAL BAHASA MALAYSIA TAHUN 6,,PEARSON LONGMAN,B.MELAYU REF (1-6),0,4.4,0,1,5,
28472,,,CANAI BACAAN 4M BACAAN RUMI UNTUK DARJAH SATU SEKOLAH-SEKOLAH RENDAH NEGARA BRUNEI DARUSSALAM 1A (EDISI BARU) 2007,,PG METUSSIN,B.MELAYU REF (1-6),0,4.2,0,0,1,
28474,,,PELAJARAN JAWI DARJAH 1B (2005),,PG METUSSIN,B.MELAYU REF (1-6),0,3.6,0,0,11,
28477,,,PELAJARAN JAWI DARJAH 1A (2008),,PG METUSSIN,B.MELAYU REF (1-6),0,4.6,0,0,10,
28492,,,PELAJARAN JAWI TAHUN 2 (2009),,PG METUSSIN,B.MELAYU REF (1-6),0,3.5,0,0,2,
28493,99917451116,,MARI MENULIS JAWI DARJAH 3,,PG METUSSIN,B.MELAYU REF (1-6),0,2.8,0,0,2,
28495,,,AKTIVITI 4M BAHASA MELAYU DARJAH 2B (EDISI BARU) 2006,,PG METUSSIN,B.MELAYU REF (1-6),0,4.3,0,0,1,
28503,,,AKTIVITI 4M CONTOH-CONTOH KARANGAN UNTUK TAHUN 34 DAN 5,,PGMETUSIN,B.MELAYU REF (1-6),0,4.5,0,0,6,
28505,99917451114,,MARI MENULIS RUMI DARJAH 3,,PGMETUSIN,B.MELAYU REF (1-6),0,2.8,0,0,5,
28506,9991745113,,PELAJARAN JAWI DARJAH 3,,PGMETUSIN,B.MELAYU REF (1-6),0,4.5,0,0,5,
28514,99917451110,,MARI MENULIS SAMBONG DARJAH 4,,PGMETUSIN,B.MELAYU REF (1-6),0,3.4,0,0,14,
28531,9991745109,,MARI MENULIS SAMBUNG TAHUN 5 (2008),,PG METUSIN,B.MELAYU REF (1-6),0,1,0,0,4,
28539,978991766056,,CONTOH-CONTOH KARANGAN DAN SURAT KIRIMAN PSR UNTUK TAHUN 6 (2016),,PG METUSIN,B.MELAYU REF (1-6),0,7.6,0,0,6,
28547,999174510X,,MARI MENULIS SAMBONG DARJAH 6,,PG METUSIN,B.MELAYU REF (1-6),0,3.9,0,0,10,
28549,,,AKITIVITI 4M BAHASA MELAYU EDISI BARU DARJAH 2B,,PG METUSIN,B.MELAYU REF (1-6),0,4.3,0,0,,
28550,9789675416996,,PANTUN BIDALAN,,CHC,B.MELAYU REF (1-6),0,5.1,0,0,2,
28551,9789670335001,,PANTUN PERIBAHASA,,CHC,B.MELAYU REF (1-6),0,5.1,0,0,2,
28552,9789675416972,,PANTUN PERUMPAMAAN,,CHC,B.MELAYU REF (1-6),0,5.1,0,0,3,
28553,9789670335018,,PANTUN SIMPULAN BAHASA,,CHC,B.MELAYU REF (1-6),0,5.1,0,0,3,
28554,9789675416958,,PANTUN BERTAMSIL,,CHC,B.MELAYU REF (1-6),0,5.1,0,0,5,
28555,9789676118547,,PANTUN BUDI BAHASA,,UTUSAN (CHC),B.MELAYU REF (1-6),0,6.8,0,0,1,
28556,9789676118523,,PANTUN ILMU,,UTUSAN (CHC),B.MELAYU REF (1-6),0,6.85,0,0,1,
28557,9789676118530,,PANTUN SAHABAT,,UTUSAN (CHC),B.MELAYU REF (1-6),0,6.85,0,0,1,
28558,9789676118493,,PANTUN JENAKA,,UTUSAN (CHC),B.MELAYU REF (1-6),0,6.8,0,0,1,
28666,9789675416989,,PANTUN TATASUSILA,,CHC,B.MELAYU REF (1-6),0,5.1,0,0,1,
28667,9789676118516,,PANTUN NASIB,,CHC,B.MELAYU REF (1-6),0,6.8,0,0,1,
28717,9789832212805,,PERUMPAMAAN,,SYNERGY MEDIA (AM),B.MELAYU REF (1-6),0,2.75,0,0,3,
28718,9789673561452,,KATA KERJA,,CHC,B.MELAYU REF (1-6),0,10.5,0,0,1,
28719,9789673561483,,KATA HUBUNG,,CHC,B.MELAYU REF (1-6),0,10.5,0,0,2,
28720,9789675060274,,PERUMPAMAAN,,MTM,B.MELAYU REF (1-6),0,1.85,0,0,5,
28721,9789670350783,,SIMPULAN BAHASA TAHUN 4.5.6 SEKOLAH RENDAH,,AM,B.MELAYU REF (1-6),0,3.2,0,0,5,
28722,9789673224388,,SIMPULAN BAHASA TAHUN 45&6,,AM,B.MELAYU REF (1-6),0,3.55,0,0,8,
28723,9789673310234,,SIMPULAN BAHASA,,MTM,B.MELAYU REF (1-6),0,1.85,0,0,5,
28724,9789673399192,,SIMPULAN BAHASA KBSR,,PEARSON LONGMAN,B.MELAYU REF (1-6),0,5.5,0,0,5,
28725,9789837438149,,WARNA SARI SIMPULAN BAHASA KBSR,,PEARSON LONGMAN,B.MELAYU REF (1-6),0,3,0,0,1,
28726,9789673213108,,PERIBAHASA,,CHC,B.MELAYU REF (1-6),0,4.5,0,0,9,
28727,9789673439157,,TUNAS BAHASA ANDA PERIBAHASA & SIMPULAN BAHASA KSSR,,ILMU BAKTI,B.MELAYU REF (1-6),0,3.15,0,0,2,
28728,9789673432837,,TEMAN BAHASA ANDA PERIBAHASA DAN SIMPULAN BAHASA TAHUN 12&3,,ILMU BAKTI (CHC),B.MELAYU REF (1-6),0,3.15,0,0,1,
28729,9789673436200,,TUNAS BAHASA ANDA PERIBAHASA & SIMPULAN BAHASA KSSR,,ILMU BAKTI,B.MELAYU REF (1-6),0,3.15,0,0,2,
28730,9789673213078,,SIMPULAN BAHASA ,,SAP (M) (CHC),B.MELAYU REF (1-6),0,5.4,0,0,14,
28731,9789675156786,,SIRI CAKNA BAHASA SIMPULAN BAHASA,,CHC,B.MELAYU REF (1-6),0,6.7,0,0,4,
28732,9789673214167,,BELAJAR SIMPULAN BAHASA MELALUI CERITA,,SAP (M) (CHC),B.MELAYU REF (1-6),0,4.5,0,0,2,
28733,9789673964840,,SIRI PEDOMAN BAHASA KAMUS BERGAMBAR SIMPULAN BAHASA,,KOHWAI & YOUNG (CHC),B.MELAYU REF (1-6),0,2.6,0,0,6,
28734,9789674541682,,BIJAK BAHASA PERIBAHASA DAN SIMPULAN BAHASA KSSR,,ILMU BAKTI,B.MELAYU REF (1-6),0,2.8,0,0,8,
28735,9991700801,,PERIBAHASA SEKOLAH RENDAH,,DBP,B.MELAYU REF (1-6),0,2.5,0,0,4,
28736,9789673224418,,PERIBAHASA DAN KATA-KATA HIKMAT TAHUN 45&6,,SYNERGY MEDIA (AM),B.MELAYU REF (1-6),0,2.35,0,0,6,
28737,9789833721719,,KOLEKSI PERIBAHASA,,MTM,B.MELAYU REF (1-6),0,1.85,0,0,8,
28738,9789675156755,,SIRI CAKNA BAHASA PERIBAHASA,,CHC,B.MELAYU REF (1-6),0,6.7,0,0,3,
28739,9789673964864,,SIRI PEDOMAN BAHASA KAMUS BERGAMBAR HIMPUNAN PERIBAHASA,,KOHWAI & YOUNG (CHC),B.MELAYU REF (1-6),0,2.6,0,0,4,
28740,,,PERIBAHASA SEKOLAH RENDAH NEGARA BRUNEI DARUSSALAM,,AKBAR PRINTER,B.MELAYU REF (1-6),0,2.8,0,0,33,
28754,9789832212799,,PEPATAN UPSR TAHUN 45 DAN 6,,SYNERGY MEDIA (AM),B.MELAYU REF (1-6),0,2.75,0,0,10,
28762,9789673561469,,SUSUNAN KATA DALAM AYAT,,CHC,B.MELAYU REF (1-6),0,10.5,0,0,1,
28763,9789673561476,,TANDA BACAAN,,CHC,B.MELAYU REF (1-6),0,10.5,0,0,1,
28765,9789673436170,,TUNAS BAHASA ANDA SISTEM BAHASA KSSR,,ILMU BAKTI,B.MELAYU REF (1-6),0,3.15,0,0,5,
28766,9789673432820,,TEMAN BAHASA ANDA SISTEM BAHASA KATA BANYAK MAKNA DAN KATA HAMPIR SAMA MAKNA TAHUN 12&3,,ILMU BAKTI (CHC),B.MELAYU REF (1-6),0,3.15,0,0,5,
28767,9789673561940,,SAMA ERTI-SINONIM,,CHC,B.MELAYU REF (1-6),0,11.25,0,0,2,
28768,9789673313198,,KATA HAMPIR SAMA MAKNA,,MTM,B.MELAYU REF (1-6),0,2.6,0,0,4,
28769,9789832212829,,KATA BANYAK MAKNA,,SYNERGY MEDIA (AM),B.MELAYU REF (1-6),0,1.95,0,0,4,
28770,9789831705216,,KATA BANYAK MAKNA BERGAMBAR,,IQB,B.MELAYU REF (1-6),0,3.15,0,0,1,
28771,9789673312023,,POLISEMI (AKTA BANYAK MAKNA),,MTM,B.MELAYU REF (1-6),0,2.6,0,0,9,
28772,9789673574285,,BIJAK (KAMUS LENGKAP) KATA BANYAK MAKNA,,MCI,B.MELAYU REF (1-6),0,5,0,0,2,
28774,9789837438156,,KAMUS KATA BANYAK MAKNA KBSR ,,PEARSON LONGMAN,B.MELAYU REF (1-6),0,5.2,0,0,4,
28775,9789832212843,,ANTONIM DAN SINONIM UPSR TAHUN 45 DAN 6,,SYNERGY MEDIA (AM),B.MELAYU REF (1-6),0,1.95,0,0,2,
28776,9789673310708,,TUNAS KATA ANTONIM & SINONIM,,MTM,B.MELAYU REF (1-6),0,3,0,0,15,
28777,9789673439249,,TEMAN BAHASA ANDA SINONIM DAN ANTONIM ,,ILMU BAKTI,B.MELAYU REF (1-6),0,4.95,0,0,4,
28778,9789673561896,,BERLAWANAN MAKSUD-ANTONIM,,CHC,B.MELAYU REF (1-6),0,11.25,0,0,2,
28779,9789673432851,,TEMAN BAHASA ANDA SINONIM DAN ANTONIM TAHUN 12&3,,ILMU BAKTI (CHC),B.MELAYU REF (1-6),0,3.15,0,0,4,
28780,9789673439164,,TUNAS BAHASA ANDA SINONIM DAN ANTONIM KSSR,,ILMU BAKTI,B.MELAYU REF (1-6),0,3.15,0,0,3,
28781,9789674541699,,BIJAK BAHASA SINONIM DAN ANTONIM KSSR,,ILMU BAKTI,B.MELAYU REF (1-6),0,2.65,0,0,4,
28782,9789675156731,,SIRI CAKNA BAHASA ANTONIM,,CHC,B.MELAYU REF (1-6),0,6.75,0,0,1,
28783,9789675156748,,SIRI CAKNA BAHASA SINONIM,,CHC,B.MELAYU REF (1-6),0,6.75,0,0,1,
28784,9789674541705,,BIJAK BAHASA SISTEM BAHASA KATA BANYAK MAKNA DAN KATA HAMPIR SAMA MAKNA KSSR,,ILMU BAKTI,B.MELAYU REF (1-6),0,2.8,0,0,4,
28817,9789837203990,,KAEDAH BELAJAR DAN BERJAYA DALAM PEPERIKSAAN,,CHC,B.MELAYU REF (1-6),0,5.7,0,1,1,
28818,9789674541675,,BIJAK BAHASA PENJODOH BILANGAN KSSR,,ILMU BAKTI,B.MELAYU REF (1-6),0,2.8,0,2,7,
28819,9789673431120,,PENJODOH BILANGAN,,ILMU BAKTI (CHC),B.MELAYU REF (1-6),0,5.4,0,3,6,
28820,9789675156779,,SIRI CAKNA BAHASA PENJODOH BILANGAN,,CHC,B.MELAYU REF (1-6),0,6.7,0,3,3,
28821,9789679561438,,KATA BILANGAN,,CHC,B.MELAYU REF (1-6),0,10.5,0,2,,
28824,9789673561933,,KATA BERBILANG-PENJODOH  BILANGAN,,CHC,B.MELAYU REF (1-6),0,11.25,0,2,2,
28827,9789673439140,,TUNAS BAHASA ANDA PENJODOH BILANGAN KSSR,,ILMU BAKTI,B.MELAYU REF (1-6),0,3.15,0,3,6,
28830,9789673432844,,TEMAN BAHASA ANDA PENJODOH BILANGAN TAHUN 12&3,,ILMU BAKTI (CHC),B.MELAYU REF (1-6),0,3.15,0,1,1,
28832,9789675060281,,PENJODOH BILANGAN,,MTM,B.MELAYU REF (1-6),0,1.5,0,5,5,
28834,9789673002696,,PENJODOH BILANGAN KBSR,,PEARSON LONGMAN,B.MELAYU REF (1-6),0,4.2,0,3,25,
28837,9789673399185,,PENJODOH BILANGAN KBSR,,PEARSON LONGMAN,B.MELAYU REF (1-6),0,5.5,0,2,2,
28839,9789837438132,,WARNA SARI PENJODOH BILANGAN KBSR,,PEARSON LONGMAN,B.MELAYU REF (1-6),0,3,0,1,1,
28841,9789670350721,,PENJODOH BILANGAN TAHUN 4.5.6 SEKOLAH RENDAH,,AM,B.MELAYU REF (1-6),0,3.4,0,2,4,
28842,9789832212775,,PENJODOH BILANGAN UPSR TAHUN 45 DAN 6,,SYNERGY MEDIA (AM),B.MELAYU REF (1-6),0,2.35,0,4,7,
28844,9789673224425,,PERUMPAMAAN TAHUN 45&6,,SYNERGY MEDIA (AM),B.MELAYU REF (1-6),0,2.75,0,4,10,
28847,9789832212812,,KATA GANDA UPSR TAHUN 45 DAN 6,,SYNERGY MEDIA (AM),B.MELAYU REF (1-6),0,1.95,0,3,5,
28850,9789837434400,,KAMUS KATA GANDA KBSR,,PEARSON LONGMAN,B.MELAYU REF (1-6),0,5.2,0,2,2,
28852,9789837438163,,KAMUS KATA BERIMBUHAN KBSR,,PEARSON LONGMAN,B.MELAYU REF (1-6),0,5.2,0,2,4,
28855,9789673561445,,KATA IMBUHAN,,CHC,B.MELAYU REF (1-6),0,10.5,0,3,4,
28858,9789675156762,,SIRI CAKNA BAHASA KATA GANDA,,CHC,B.MELAYU REF (1-6),0,6.75,0,1,1,
28860,9789673561926,,KATA IMBUHAN,,CHC,B.MELAYU REF (1-6),0,9.4,0,2,2,
28863,9789673213092,,IMBUHAN,,SAP (M) (CHC),B.MELAYU REF (1-6),0,5.4,0,4,21,
28866,9789673561919,,PENGULANGAN KATA-KATA GANDA,,CHC,B.MELAYU REF (1-6),0,11.25,0,1,1,
28888,9789670519302,,KARANGAN BERGAMBAR TAHAP 1,,GLOBAL (CHC),B.MELAYU REF (1-6),0,5.7,0,16,,
